{
  "$schema": "https://json-schema.org/draft/2020-12/schema",
  "$id": "https://market-opportunity-radar.invalid/contracts/envelope.v2.json",
  "title": "Sobre común v2",
  "description": "Mismas reglas que envelope.v1: NO transporta lease, ningún dato personal ni contenido privado en claro (van en payloads *.private.* cifrados y referenciados por private_ref), tamaño serializado máximo 32768 bytes (lo comprueban los validadores). Añade los kinds whatsapp.list_chats y whatsapp.resolve_contact. sync, result, list_chats y resolve_contact usan payloads v2; pair, send, browser.* y telegram.command reutilizan sus payloads v1. Durante la migración los consumidores aceptan envelope.v1 y envelope.v2.",
  "type": "object",
  "additionalProperties": false,
  "required": [
    "schema_version", "message_id", "operation_id", "correlation_id",
    "owner_ref", "kind", "deadline", "attempt", "payload"
  ],
  "properties": {
    "schema_version": {"const": 2},
    "message_id": {"$ref": "common.v1.json#/$defs/id", "description": "Único por mensaje; clave de deduplicación de transporte."},
    "operation_id": {"$ref": "common.v1.json#/$defs/id", "description": "Operación de negocio; varios mensajes pueden compartirla."},
    "correlation_id": {"$ref": "common.v1.json#/$defs/id", "description": "Run o conversación que agrupa operaciones."},
    "causation_id": {"$ref": "common.v1.json#/$defs/id", "description": "message_id que causó este mensaje; se omite (no null ni vacío) en el primero de la cadena."},
    "owner_ref": {"$ref": "common.v1.json#/$defs/opaque_ref"},
    "kind": {
      "enum": [
        "browser.read", "browser.result", "whatsapp.pair", "whatsapp.sync",
        "whatsapp.send", "whatsapp.result", "telegram.command",
        "whatsapp.list_chats", "whatsapp.resolve_contact"
      ]
    },
    "deadline": {"$ref": "common.v1.json#/$defs/utc_datetime"},
    "attempt": {"type": "integer", "minimum": 1},
    "session_ref": {"$ref": "common.v1.json#/$defs/session_ref"},
    "expected_version": {"type": "integer", "minimum": 0, "description": "Versión de sesión esperada (CAS). whatsapp.pair exige 0; sync, send, list_chats y resolve_contact exigen >= 1."},
    "refs": {
      "description": "Blobs inmutables adicionales referenciados con hash.",
      "type": "array",
      "maxItems": 16,
      "items": {
        "type": "object",
        "additionalProperties": false,
        "required": ["blob_key", "sha256"],
        "properties": {
          "blob_key": {"$ref": "common.v1.json#/$defs/blob_key"},
          "sha256": {"$ref": "common.v1.json#/$defs/sha256"}
        }
      }
    },
    "payload": {"type": "object"}
  },
  "allOf": [
    {"if": {"properties": {"kind": {"const": "whatsapp.pair"}}}, "then": {"required": ["session_ref", "expected_version"], "properties": {"expected_version": {"const": 0}, "payload": {"$ref": "whatsapp.pair.v1.json"}}}},
    {"if": {"properties": {"kind": {"const": "whatsapp.sync"}}}, "then": {"required": ["session_ref", "expected_version"], "properties": {"expected_version": {"minimum": 1}, "payload": {"$ref": "whatsapp.sync.v2.json"}}}},
    {"if": {"properties": {"kind": {"const": "whatsapp.send"}}}, "then": {"required": ["session_ref", "expected_version"], "properties": {"expected_version": {"minimum": 1}, "payload": {"$ref": "whatsapp.send.v1.json"}}}},
    {"if": {"properties": {"kind": {"const": "whatsapp.list_chats"}}}, "then": {"required": ["session_ref", "expected_version"], "properties": {"expected_version": {"minimum": 1}, "payload": {"$ref": "whatsapp.list_chats.v2.json"}}}},
    {"if": {"properties": {"kind": {"const": "whatsapp.resolve_contact"}}}, "then": {"required": ["session_ref", "expected_version"], "properties": {"expected_version": {"minimum": 1}, "payload": {"$ref": "whatsapp.resolve_contact.v2.json"}}}},
    {"if": {"properties": {"kind": {"const": "browser.read"}}}, "then": {"properties": {"payload": {"$ref": "browser.read.v1.json"}}}},
    {"if": {"properties": {"kind": {"const": "browser.result"}}}, "then": {"properties": {"payload": {"$ref": "browser.result.v1.json"}}}},
    {"if": {"properties": {"kind": {"const": "whatsapp.result"}}}, "then": {"properties": {"payload": {"$ref": "whatsapp.result.v2.json"}}}},
    {"if": {"properties": {"kind": {"const": "telegram.command"}}}, "then": {"properties": {"payload": {"$ref": "telegram.command.v1.json"}}}}
  ]
}
